{
  "schema_version": "location-binding.v1",
  "uuid": "00000000-0000-4000-8000-000000000001",
  "revision": 1,
  "organization_uuid": "00000000-0000-4000-8000-000000000002",
  "device_uuid": "00000000-0000-4000-8000-000000000003",
  "configuration_uuid": "00000000-0000-4000-8000-000000000004",
  "generation": 1,
  "latitude_parameter_uuid": "00000000-0000-4000-8000-000000000005",
  "longitude_parameter_uuid": "00000000-0000-4000-8000-000000000006",
  "accuracy_parameter_uuid": "00000000-0000-4000-8000-000000000007",
  "pairing": "same_event",
  "max_age_seconds": 90,
  "max_future_skew_seconds": 5,
  "allow_unknown_accuracy": true
}
